A	B	C	D	E	F
GroovyMuffin	ChocolateChip	Fudge brownies	Chewy cookies	Snickerdoodles	Oatmeal raisin
HappyTaco	Beefy burritos	Spicy tacos	Quesadillas with cheese and salsa	Margaritas on the patio	Ceviche with lime wedges
TechWizard	AI-powered robotics	Virtual reality gaming	Self-driving cars	Personalized AI assistants	Quantum computing software
AdventureSeeker	Mountain biking trails	River rapids for kayaking	Paragliding in the Alps	Scuba diving in the Caribbean	Hot air balloon rides over ancient ruins
CreativeGenius	Painting the night sky	Playing the saxophone	Dancing to jazz rhythms	Poetry readings at an open mic	Sculpting with recycled materials
NatureLover	Hiking through redwood forests	Exploring coral reefs	Watching sunsets from mountaintops	Discovering hidden waterfalls	Kayaking down crystal clear rivers
FitnessFreak	Marathon training	Weightlifting championships	Yoga retreats in Bali	Running races in the park	Bodybuilding competitions
FoodieFrenzy	Gourmet cooking classes	Food truck festivals	Exotic cuisine road trips	Food blogging workshops	Private chef dinners
TravelEnthusiast	Backpacking through Europe	Island hopping in Greece	Road tripping across the American West	Bungee jumping in New Zealand	Paragliding in the Swiss Alps
PhotographyPro	Landscapes of the Grand Canyon	Portraits of wildlife in Africa	Cityscapes of Tokyo	Underwater photography in the Caribbean	Aerial photography of Hawaiian beaches
