A,B,C,D,E,F
Rndm1234567890,Tkdflksjhgfds,Qwertyuiopasdfghjklzxcvbnm,Fsdfsdfgsdfgsdfgsdf,Njkmqwertuytrewqytfurvpjsdf,"Oops, I forgot something again!"
Lovely876543210,Ksdhfiuygtreef,Poniesaremylife90123,Ggrrraahhbllttrreofthecar,I'm feeling quite silly today,"Yessss, I found it under the couch cushion"
Spectacular789012345,Jumblingalfredangryeagle,Mysterious876543210,Zigzaggingthroughlife90123,"Oh no, where did my keys go?","Ah ha, I see what you did there!"
Futuristic6789012345,Blargleblargleflumplenook,Enchanted876543210,Snazzywhistlewhileyouwork,"Oof, that was a close call!",Huzzah! I found my favorite mug!
Incredible4567890123,Flumplenook876543210,Fancifulgardenworld90123,Ribbitrightbackatyaaaa,I think I just saw a unicorn,"Of course, I have a cookie for you!"
